q_id,query_clean
1741,Случайно положил деньги на кредитную карту Положил выше лимита. сейчас могу обратно их без процентов перевести на дебетовую карту?
1742,меня интересует кэшбэк на рублей
1743,Кешбек за транспорт
1744,каком отделении на пл Ленина?
1745,узнать номер расчётного счета
1746,Реквизиты карты не открываются
1747,Где они???
1748,Как узнать предодобренных кредитах
1749,Нету кэшбека
1750,Где можно посмотреть действующие счета
1751,Из личного кабинета исчезла карта
1752,"Поменяли номер мобильного банка, пользоваться не получается?"
1753,добавил резервный номер. Он уже есть моем приложении?
1754,Куда Москве можно подать исполнительный лист? какое отделение?
1755,Справка реквизитах
1756,есть ли вас карта при помощи которой можно посещать бизнес залы по миру?
1757,"Один из банкоматов на города, вновь не работал! Нужно установить еще хоть работосаособный на Говорова ""Сибирском городке"" или лучше где-то на рынке Черемушках"
1758,"На главной странице написано деньги почти ваши, это что значит?"
1759,Не показывает реквезиты
1760,течении недели могу оплатить
1761,При попытке привязать банковскую карту Мострансавто код приодит на старый номер
1762,Нет полных реквизитов карты
1763,За июнь
1764,Плюсы условия
1765,Вознаграждение мне пришло меня вопрос по кешбеку?
1766,Оформила кредитку Можно ли ей воспользовать до прихожа пластика?
1767,"Не критично, но нельзя настроить информирование от банка виде push-уведомлений, не старинных СМС?"
1768,их положила чтобы оплатить долг!!!
1769,как узнать свой счёт бик?
1770,Оператор человек по кешбэк
1771,Офис на вокзальной
1772,"Хочу уточнить про кэшбэк на транспорт, если оплачу за карту АЛГА, то мне начислят кэшбэк, поможете разобраться?"
1773,Международные?
1774,Номер расчетного счета
1775,"Как на детскую карту привязать телефон внука, чтоб по его телефону переводили ему деньги на карту?"
1776,лицевой счёт
1777,Реквизиты счета
1778,Мои счета
1779,Найти рариспонденский счет БИК
1780,Не пришло уведомление переводе
1781,хочу выбрать другую карту для оплаты. старую удалить
1782,Отключить входящие переводы
1783,какой меня вид карты
1784,обслуживаюсь ДО МОЛОДЕЖНАЯ
1785,Где посмотреть самостоятельно
1786,Можно записаться?
1787,"банк оповестил, что скоро перестану быть зарплатным клиентом, но бухгалтерии организации такой информации нет, связи чем такое оповещение?"
1788,Рассчетный счёт
1789,Свой счет
1790,где смотреть
1791,Кэшбек на продукты
1792,Как мне сделать выписку реквизитов карты для суда?
1793,Срок действия карты
1794,Поменять пароль для входа
1795,кешбек июне
1796,"Просили позже написать, по вопросу кэшбэком"
1797,Почему не приходить смс зачисление зарплаты
1798,Все мои счета
1799,запрашивал документы по кредиту июня на почту до сих пор ничего не пришло
1800,Где посмотреть дату рождения
1801,Интересует кеш бек за транспорт
1802,спрашиваю получу за это кэшбек?
1803,Есть ли меня продукты банка
1804,Супер кэшбэк суммируется кэшбеком за месяц?
1805,"Не могу открыть приложении реквизиты карты, именно номер"
1806,Посмотреть статус заявки
1807,Сколько карт счетов меня сейчас альфа банке
1808,Можно записаться ко времени? Чтоб очереди не ждать
1809,Одобрить перевод по сбп
1810,делаю свое телефонное приложение «трекер финансов» могу ли сделать так чтобы операции из банка выгружались автоматически мое приложение. Что для этого надо?
1811,как поменять пароль для входа?
1812,мне написали что меня есть заявка как можно узнать мне ее одобрили
1813,Хочу узнать по обоим счетам
1814,Нужна официальная справка реквизитами кредитной карты
1815,Какие продукты банка меня есть
1816,При попытке подтверждения добавочного телефона смс отправляется на неправильный номер
1817,что за сообщения поступают от вас?
1818,"где найти счёт, на который скидывать сумму ежемесячную"
1819,Ну по кешбеку да?
1820,какое время открывается биржа?
1821,"меня уже есть деньги на счету,погаси его"
1822,Можно ли оплачивать кредит любой суммой не фиксированный платежом
1823,Как закрыть счёт на котором
1824,",оформил кредитную карту,где могу увидеть ее приложении?"
1825,Хотя настройках стоит только пуш
1826,Поменял способ уведомлений. Поставил смс пуш. Еще не было списаний. Сегодня попробую сообщу.
1827,Можно ли платить альфа картой онлайн приложении золотого яблока?
1828,Могу ли оплатить кредитной картой туристическую путевку по реквизитам туроператора (расчетный счет)?
1829,Детская карта изменился номер телефона
1830,Мне нужна информация поступлении денег на мою карту от
1831,как приложении заказать справку реквизитами счета?
1832,Хотел узнать на счет кешбека авиабилетов
1833,неправильно указала реквизиты
1834,Как вернуть невостребованный остаток
1835,"отключите мне смс-оповещение, мне нужны только пуш уведомления!"
1836,Отключите номер телефона от карты
1837,Можно позже отплатить
1838,Почему смс код приходит на номер который меня не привязан ни чему?
1839,номер счёта которому привязана карта?
1840,Подключить другой номер
1841,Что за карта alfa-only?
1842,Как узнать номер уин платежа?
1843,Заявление на кредитную карту была другая сумма почему изменилась сумма!?
1844,Про реквизиты подробнее объясните Как это сделать
1845,Мне не понятно почему по моей кредитной карте долг был внесла еще осталось меня за карту остальной расход за что
1846,можно стикер привязать основной карте?
1847,Как приложении посмотреть баланс счетов
1848,Получить выписку реквизитами банковской карты для начисления зп
1849,кашбэк за проезд
1850,как поменять пароль входа?
1851,Только что оформила кредитную карту
1852,Почему нет расхода последнего истории
1853,Есть ли мен карты или счета
1854,"раньше приходили пуш-уведомления пополнении карты, хотел узнать почему перестали приходить?"
1855,Кэшбэк за покупку
1856,где получить БИК?
1857,какой банк?
1858,не приходят сообщения от вас для подтверждения переводов
1859,Смс от вас?
1860,Смс стали приходить!
1861,как мне вывести средства
1862,Михаил! здесь про кэшбэк %.
1863,куда исчез счёт на котором было
1864,Где можно посмотреть мои счета?
1865,Где найти расчетный счет или узнать есть ли он меня
1866,Уведомления от банка
1867,где могу посмотреть свой корр счет
1868,Перевод на погашение кредита
1869,узнать через сколько придет займ
1870,Подключите вы мне
1871,Не открываются реквизиты карты
1872,"Проблема сообщениями на телефон. банке мучились час дома не приходят сообщения, номер указан верно."
1873,"уже при оформлении кредита наличными выскакивает окно что сервис временно не работает не получается его оформить, что можно этим сделать или когда сервис заработает?"
1874,Кредитный лимит
1875,вопрос по акции Альфа карта кэшбеком
1876,Непонятно деньги одобрили вроде когда зачислят когда отдавать вопрос
1877,По условиям кэшбека
1878,расчетный счёт какого числа
1879,",я заказывала кредитную карту мне одобрили, откуда мне забрать карту?"
1880,Справка реквизитах
1881,"Оформила кредитную карту. онлайн банке не отображается, что кредит одобрен..."
1882,не знаю какой счет можете помочь
1883,Мне одобрили кредитную карту почему ее не видно?
1884,Неверно определяются реквизиты
1885,"Не высветились реквизиты на перевод, как узнать?"
1886,Как узнать свой расчетный счет?
1887,Почему не приходят уведомления переводе денег
1888,Доступ lounge key
1889,номер счета дебетовой карты
1890,Реквизиты карты
1891,Кэшбэк по сб
1892,меня заблокировали сим карту мне нужно будет поменять номер телефона на этом аккаунте на другой как это возможно?
1893,Отключить входящие переводы СБП
1894,"Как мне узнать почему перестали приходить мне уведомления зарплате, только могу посмотреть это приложении!?"
1895,Как установить пароль на вход приложение
1896,Почему только кредитный лимит
1897,",оформила кредит, требуют подписать, не поняла подписала или нет"
1898,"не хочу снимать, хочу получить на счёт"
1899,"Приложение запрашивает обновить номер телефона, но номер прежний"
1900,на телефон
1901,мне все равно не приходят уведомления списаниях поступлениях
1902,"Прошло дней, почему заявка на кредит под залог активна, когда она уйдёт архив? Условия по данной заявке не устраивают"
1903,"Не вижу карту приложении, вчера привёз менеджер"
1904,Вернуть со счета погашения кредита
1905,Номер телефона для детской карты не подходит
1906,номер счета
1907,"Мне нужно реквизиты моего счета для работодателя, чтобы получать зарплату"
1908,уведомления от приложения
1909,почему приложение не отображается карта которую заказали?
1910,Кэшбэк начислят?
1911,Расчетный счет банка
1912,"Он уже одобрен,но деньги не дают"
1913,Бонусы привилегии
1914,Сумма долга не идет расходами
1915,Где посмотреть где меня кредитный счёт
1916,Выдают ли денги выходные
1917,"хотел узнать, что кешбэком за май?"
1918,"Как то можно сделать, чтобы мои операции по счету видел другой пользователь?"
1919,Как узнать кредитный счёт
1920,где смотреть этот счёт
1921,"Почему не могу посмотреть реквизиты карты? Пишет, что менял телефон, но его не менял Дайте доступ реквизитам"
1922,Хочу воспользоваться
1923,Реквизит
1924,За месяц текущий
1925,Где посмотреть расчетный счет карты
1926,Можно ли выпустить новую карту которая будет привязана другому номеру телефона
1927,Где найти расчетный счёт карты
1928,Реквизиты счета нужн
1929,Реквизит узнать
1930,Расчётный номер
1931,Где найти счёт?
1932,Как узнать какой бик банка
1933,Сегодня уведомления нет
1934,"Не приходят пуш уведомления на телефон от банка. настройках банковского приложения всё включено, настройках телефона тоже уведомления включены. Переустанавливал приложение, но проблема осталась"
1935,Как получить
1936,Где посмотреть
1937,"Никакую, спрашиваю кэшбэк на июль"
1938,"Если будет кешбек, то оставим"
1939,Наименование или БИК банка получателя
1940,Случайно закинула деньги на кредитную карту лишние
1941,Почему при оплате СПБ не подтягиваются мои КК?
1942,Баланса нет
1943,Ссудный счет
1944,"Сегодня получил кредитную карту, но она не отображается приложении"
1945,Когда появится кредитная карта банке онлайн?
1946,инн бик банка?
1947,"почему если мне одобряют лимит на тысяч, вы мне звоните говорите все здорово, все круто одобрили, итоге тысяч"
1948,Не хватает денег на житьё
1949,Когда поступят деньги кредитные?
1950,Если сменить оператора на телефонном номере будут ли ограничения.
1951,"ИНН получателя Номер счета цифр, начинается БИК банка Помогите этим"
1952,Какой биг банка
1953,Кэшбэк за покупку оплатой по счету
1954,"как снова зайти онлайн банк. Ввожу номер телефона, пишет некорректный номер"
1955,где мне найти БИК?
1956,Опять нету уведомления
1957,хочу узнать состояние кредитной карты
1958,Почему недоступны кредитные деньги?
1959,Почему при вводе номера карты смс приходит на другой телефон?
1960,Вопрос по кешьэку
1961,Почему мне не приходят уведомления пополнении счёта?
1962,"получил внж, ранее банке сообщили, как получу смогу переводить по номеру телефона СБП. Сюда направить можно свой ВНЖ?"
1963,поступали средства на мой кредитный счёт?
1964,Начисление
1965,Кэшбэк июнь
1966,Поменяла номер телефона сегодня. Не приходит СМС на новый номер
1967,"меня были кредитный лимит на картах, его истратил, долг закрыл новый кредитный лимит будет на них появляется"
1968,Можно ли eSIM перенести на другой телефон?
1969,Где он находится
1970,Пуш
1971,Когда обновится номер?
1972,"Где посмотреть БИК ,СЧЕТ к/с получателя"
1973,Начисление кешбек
1974,Как сменить реквизиты счёта
1975,Как узнать БИК
1976,"Оформила онлайн кредит, что-то нет открытого кредитного счета?"
1977,Где узнать бик банка
1978,",на какой номер позвонят по поводу кредитной карты?"
1979,Как получить банковские реквизиты отметкой банка?
1980,Почему перевод через предложения только через смс Раньше приходил пуш код все
1981,Офис Альфа-Банк рядом
1982,Все что есть
1983,Гузель не могу найти приложении нужный счет ???
1984,Где ее посмотреть
1985,Доброе. Списалось. Уведомление только не ушло
1986,Подключить
1987,Начисленный кешбек?
1988,Как привязать стик определенной карте?
1989,что такое альфа чек почему меня списало рублей
1990,Работает ли карта альфа банка на шри данке
1991,Сменить пароль для входа
1992,Где его увидеть?
1993,Риквизит
1994,Готова до конца недели внести ежемесячные платежи по кредиту кредитной карте
1995,"Выше просила помочь разобраться кэшбеком его сохранением Напоминаю, что ожидаю ответ."
1996,меня отключены уведомления почему смс стали приходить?
1997,Кешбек от Тебоил
1998,Данные для полных реквизитов перевода
1999,Номер данной карты
2000,Вы поменяете телефон?
2001,про какие деньги идёт речь сообщение пришло что мне зачислять деньги
2002,"вчера оформила детскую карту, сегодня пыталась прикрепить ее отдельному счету карта приложении перестала отражаться"
2003,Есть вопросы по начислению кэшбэка.
2004,Оформлял кредит скачал приложение кредите отказали карту оформили но не выдали приложении она есть
2005,Мне нужен счет карты моей
2006,пришлите полное наименование банка
2007,"Мне пришло сообщение, что сменила номер телефона. номер телефона не меняла!"
2008,Почему когда подал заявку на кредитную карту одобренный лимит был т.р. при выдачи карты т.р
2009,Когда уже пуш уведомления нормально заработают?
2010,хочу уменьшить сумму кредитной карты погасить ее текущей суммой
2011,Где найти справку реквизитами?
2012,Запросить расчетный счет
2013,связи финансовыми трудностями
2014,"Нужно перевести деньги на Сбербанк. Требуется номер подтверждения. Пуш уведомления подключил но не приходят. Смс получить нереально так как нет сотовой связи, только интернет. Почему не приходят пуш смс."
2015,Почему не приходят смс списании со счета
2016,Продлить на дней
2017,Получен кредит или не получен? Как им пользоваться?
2018,Почему этих денег нет меня на счете?
2019,не могу открыть номер карты
2020,Не приходят смс про смене номера
2021,мобильном приложении где находятся мои карты
2022,Не меняется номер через настройки
2023,Кэшбэк за покупки сколько по карте?
2024,Нужны реквизиты куда будет приходить зарплата
2025,как узнать счет карты что перевести на неё зарплатную сумму
2026,Пришла заработная плата. Не было сообщений зачислении. Напишите причину
2027,Как платить картой за такси?
2028,как вывести денежные средства со счета погашение кредита?
2029,"попросил кредит наличными на мне его одобрили, пришла смс, ничего не изменилось одобрением?"
2030,зайду отделение банка для прояснения ситуации
2031,Мне срочно нужны реквизиты по этой операции
2032,отделении Альфа банка на Большой Грузинской Как могу получить консультацию? Тут никто ко мне не подходит
2033,месяц
2034,Не удалось получить реквизиты карты. Попробуйте позже
2035,На какие карты подключено уведомления
2036,"не подключала уведомления, обслуживание карты обещали бесплатно!"
2037,Остаток счета
2038,Здорово! Вопрос про безлимитный кэшбэк
2039,хочу долг кредитной карты перевести кредит
2040,Смс по счёт для кредитной карты не приходит! Напишите мне его этом чате!
2041,хочу перенести номер телефона мужа на альфа мобайл сим карта на меня оформлена мы можем через его аольфа онлайн запросить на перенос карты
2042,ещё раз как сделать чтобы получить смс уведомление не пуш уведомление
