q_id,query_clean
3496,Что за предложение меня висит программе зачислим моментально руб что это?
3497,Почему меня не отображается кредит?
3498,заказывал карту лимитом пришла на почему?
3499,"Произведено кредитование на руб. Получила так же Но приложении указано, что Почему"
3500,"Оформил кредитную карту,ей уже можно начать пользоваться?"
3501,Взял кредит он не отображается
3502,",заказала кредитную карту,но сожалению не вижу её приложении( как можно это посмотреть?"
3503,Когда будет зачисление кредита
3504,"Мне одобрен кредит на залог авто. Вы писали, что деньги поступят через часов, но нет зачислений. Как быть"
3505,"вчера оформляла кредит, могу узнать, когда поступят деньги на счет"
3506,Когда придут оставшиеся деньги на кредитную карту
3507,по счету поступил платеж на сумму Отсутствует возможность посмотреть онлайн банке
3508,Как можно узнать операции по закрытой кредитной карте онлайн?
3509,"Почему истории нет платежа, который сейчас отправляла на сумму ₽?"
3510,"почему истории не вижу оплату на сумму последнюю, хотя деньги списаны?"
3511,оплатила только что по QR за сад истории нету деньги списались где посмотреть статус этой операции
3512,Меня интересует платёж проведённый сегодня. Который отразился как штрафы налоги на руб... истории почему то
3513,уточните не вижу платежи жилищно-коммунальных услуг общей ленте истории платежей как это сделать чтобы их видеть сразу все расходы сразу которые были проведены карты
3514,"Покупки нет истории, она не отображается"
3515,почему операция на видна истории?
3516,Только что оплатила коммунальные услуги рублей нет истории операций
3517,"Почему не вижу историях операцию по оплате счета на сумму Мне необходимо предоставить получателю информацию, что оплатила счет"
3518,почему меня истории не отображается оплата по реквезитам
3519,"Вопрос, почему истории не отображается?"
3520,Почему платеж не отобразился истории?
3521,Почему нет операции на списание за сегодня на руб
3522,Как посмотреть кому перевод прошел
3523,Историю переводов как очистить телефоне
3524,"почему оплатила квитанцию, деньги сняли, истории нет её?"
3525,произвела сейчас оплату капитального ремонта на сумму пятьсот восемь рублей девяносто пять копеек платеж совершен не вижу его истории куда он меня делся
3526,"ещё, за год"
3527,"Почему не вижу историю операций по совместному счету? Вижу только свои операции по картам, которые нему привязаны. что отправляет владелец счета не него-не вижу"
3528,он оплатился? не вижу истории
3529,Когда истории отобразится перевод на расчетный счёт другой банк
3530,"только что осуществил оплату коммунальных платежей на сумму истории не отображается платёж, при этом сумма средств на карте уменьшился, прошёл ли платёж можно ли получить сведения выполненной операции?"
3531,История операции
3532,Почему не отображается оплата газа истории операций?
3533,Почему не отражается платежах
3534,"Геннадий, сделала платёж по ЖКУ Альфа Счёта операция не отобразилась истории, но деньги списались со счёта"
3535,Ничего не отражается истории!
3536,как сделать так что совместном счете все участники видели историю операций
3537,Мне надо узнать каму перевела деньги
3538,Не знаю когда приложите все историю
3539,Почему Истории платежей не отоажается платёж от за обучение?
3540,Как мне найти операцию
3541,Почему не отображается две операции истории?
3542,"оплачивала услугу за образование. Деньги со счета ушли, но истории нет уведомления списании"
3543,Не высвечивается платеж истории
3544,Как узнать от кого перевод
3545,Операции были более года назад
3546,"меня приложении не отображается история, брокерский счет, карта"
3547,"платила со своего счета за обучение ребенка, деньги списались моего счета, но квитанции истори не вижу"
3548,Перевод не отображается приложение
3549,"оплатил учебу.Деньги списались, но истории платежа нет. Что делать?"
3550,"сделала перевод, но он не отображается истории, почему? Списания со счетов. Списание со счета Перевод на сумму RUB; Получатель: сентября сентября"
3551,Виза или мастеркард
3552,Гонконг
3553,My card is blocked
3554,Smart deal.
3555,Есть ли возможность выпуска дебетовой карты Visa?
3556,"Могу ли получить карту, находясь Крыму?"
3557,Можно ли платить моей картой дубае?
3558,"Интересует оплата за границей картой, собираюсь отпуск, как это сделать?"
3559,Kion
3560,Работает ли альфа тревел Сербии
3561,"планирую осенью полететь Китай, вас есть карта которая будет там работать?"
3562,Для оплаты за рубежом сейчас доступны какие то карты?
3563,",можно взять карту халва"
3564,python
3565,Моя карта можно ли ей расплачиваться Абхазии?
3566,"Ирина, открыла счет белорусский при отплата как понять, какой картой оплачиваю?"
3567,Как платить за границей?
3568,На карту MasterCard alfa pay не распространяется?
3569,Можно кредитной картой платить Китае?
3570,Union pay
3571,Возможно ли заменить Mastercard на мир?
3572,You have credited rube for alfa subscription though haven't taken it
3573,Можно ли по карте рассчитаться Турции
3574,"То есть только картой, мирпэй?"
3575,Есть ли альыа банка карта юнион пэй?
3576,Visa карта есть меня?
3577,Можно открыть карту union pay?
3578,Visa
3579,Во Вьетнаме работает карта Альфа банка?
3580,не работает карта Visa при бесконтактном способе оплаты каким образом можно заменить карту?
3581,работает ли ваша карта альфа банка белоруссии
3582,Вас можно оформить карту Юнион пэй?
3583,Могу ли расплатиться Турции
3584,"Могу ли рассчитываться этой картой Валберис, Джум."
3585,Доброго вечера вопрос получится ли произвести оплату карты Украину? Или сейчас этим проблемы
3586,могу моей картой расплатиться Белоруссии
3587,Вас есть карты которые работают Европе
3588,Мне нужна карта visa
3589,возможна ли оплата картой МИР Шардже?
3590,"Мне сказали, что Альфа банк можно воспользоваться услугой открытия иностранной карты visa/mastercard. Такая услуга действительно есть?"
3591,Не карта мир карта Visa России она не работает при бесконтактном способе оплаты
3592,Хочу карту для оплаты за границей
3593,Оплата картой за границей
3594,"Hi, want to change my contact number to:+"
3595,Как установить лимит на определённую категорию товаров?
3596,Как сделать чтобы не за что карты не снимали
3597,Если установлю лимит. что пользоваться не смогу детской картой?
3598,"Можно подать. меня вопрос по теме выше, ступил поставил ограничение по оплате здесь приложении, можно его снять?"
3599,есть ограничение по магазинам? по цене продукта?
3600,Хочу чтобы моей карты не совершали интернет покупки
3601,"Сделайте, чтобы можно было оплатить"
3602,Как установить лимит на покупки на карте?
3603,Как настроить лимит на детскую карту
3604,Заявление на ограничение списания
3605,Как настроить лимит операции по детской карте
3606,"Можно ли частично снять ограничение Чтобы можно было совершать покупки, оплачивать коммунальные услуги так же переводить исключительно родственникам?"
3607,Запретить онлайн оплату
3608,Как снять ограничение лимита карты
3609,"Поставить запрет об оплате эту компанию можно, мне нельзя менять реквизиты, получаю соц выплаты"
3610,могу сам установить или снять лимит?
3611,Как убрать лимит на операцию
3612,меня стоят какие то ограничения оплаты интернете
3613,меня нет лимитов. Операция запрещена покупкам по карте номером на конце.
3614,На будущее уже рекомендация банку. Ну предусмотрите возможность отключения любых переводов на детские карты/счета. Это элемент безопасности.
3615,Как убрать ограничение по картам
3616,Нужно изменить лимит на переводы по карте что оплатить крупную покупку
3617,если открыть новую карту ограничения нельзя снять
3618,Как разрешить перевод между счетами
3619,почему мне поставили запрет на переводы
3620,Запрет на списание карты
3621,Как поставить запрет на переводы по сбп на детской карте?
3622,Могу расплачиваться картой если поставили ограничение?
3623,Как установить лимит по карте на день
3624,получается хочу сбрасывать этот лимит каждого числа
3625,как убрать запрет оплаты интернете
3626,",можно ли поставить запрет на списание денег"
3627,Лимит все равно не снимается
3628,помогите разобраться лимитами?
3629,Как мне сделать чтоб могла расплачиваться кредитной картой
3630,Как установить запрет на выдачу дебетовых карт ребёнку?
3631,Хочу снять ограничения по платежам
3632,Как тзменить суточный лимит снятия наличных?
3633,Как мне установить отдельные лимиты на детскую карту
3634,"могу ограничить лимит для своего близкого, только для него"
3635,Как установить запрет на оплату интернете?
3636,Как избежать блокировки карты от переводов по новому закону?
3637,Хочу снять ограничение по карта для снятия денег
3638,Как можно на время запретить транзакции на кредитной карте
3639,"Если отпал чип от банковской карты, закажу новую расчетный счет останется прежним"
3640,Как сменить пинкод карты
3641,Сменить код
3642,Забыл пинкод от карты как поменять личном кабинете
3643,"По карте (на супругу) не удается рассчитаться. Пишет, что неправильный код. итоге пин-код заблокирован. что сделать?"
3644,Забыла пароль от карты?
3645,как узнать какой меня пин код
3646,Как узнать пароль от карты
3647,меня заблокировалась карта от неправильного ввода пин кода. Прошло дней. Что мне делать?
3648,"как изменить пин код, используемый при оплате картой на кассе?"
3649,"Как узнать Пин код карты, чтобы пополнить счет через банкомат"
3650,Как могу сменить пин код
3651,"Забыл пароль от кредитной, карты. Что делать?"
3652,"Не понимаю, установился пин код или нет"
3653,Как посмотреть пин код если забыли
3654,Как мне узнать какой код
3655,Сын несколько раз банкомате неправильно набрал пинкод. она заблокировалась. Не может ею оплатить
3656,Как понять пин код
3657,Как использовать чип
3658,"Здрайствуйте, пытался войти банк писал что пороль не верный нужно было срочно оплатить но не смог только сделал"
3659,Изменить пин код
3660,",как узнать пинкод от карты если забыл?"
3661,Как установить пин код
3662,где посмотреть мой пин код карты его забыла
3663,Как поменять пин -код?
3664,"Как найти свой пароль для выдающегося партнёра? Есть почта моя, но не помню пароль"
3665,Как изменить пинкод карты?
3666,"Попыталась сделать оплату кредитной картой, но ничего не получилось. Причина: лимит ввода пин исчерпан. Пин ввела один раз всего. Что делать?"
3667,Забыла пин код карты
3668,Почему не могу поменять пароль на карте не приходит сообщение
3669,Забыл пин-код от карты
3670,"как изменить пароль карты, если забыли"
3671,"Не помню пин код карты, чтобы снять наличные банкомате"
3672,Изменить пинкод
3673,"Вчера не смогла банкомате дважды снять деньги.Писал,что пин-код не верен"
3674,Забыл пинкод от карты как можно востановить?
3675,Нет банкомата чтобы активировать пин код
3676,"Как сменю ,если старый мне неизвестен, где узнать старый могу кого?"
3677,Как пин код карте восстановить?
3678,Хотел сменить пин код
3679,Пин код не правильно ввела
3680,По карте пин заблокирован
3681,видимо пин путала
3682,Как заменить пин на карте
3683,Почему сумма долга по больше чем трат по ней?
3684,сколько снимал последний раз карты зарплатной
3685,"не могу понять сколько моих денег, где смотреть, очень непонятно все вас"
3686,Есть ли приложении альфы возможность посмотреть сколько потратил за месяц на конкретном счёте?
3687,не как посмотреть траты прошлом месяце?
3688,"Не знаю, когда, меня много трат пользуюсь картой ежедневно, не могу отсмотреть все месяцы. Посмотрите по фильтрам сами"
3689,"Не предупредили про списание комиссии за выпуск, не рассчитывала на данные расходы"
3690,Как убрать все прочие расходы
3691,Среднестатистическая какая прошлом месяце была?
3692,Как отражается поношение по карте
3693,Привязана ли ставка тратам?
3694,Уже потрачено
3695,Есть ли округление расходов
3696,Можете сориентировать по сумме?
3697,Так посмотреть общую сумму трат за определённый период
3698,"чтоб меня перестал отображаться некорректный расход на рубля категории ""Подарки"""
3699,можно подробнее прочих расходах?
3700,Два месяца без условий трат?
3701,Не поймёшь сколько внесено сколько на счету
3702,"Так было на счету (округлил) Потрачено по мелочи еще, должно было остаться даже больше"
3703,"Почему каждый день сумма, которую необходимо потратить для повышения ставки растет. Вчера было необходимо потратить тыс рублей. Сейчас тыс рублей"
3704,Как посмотреть траты за месяц?
3705,Почему не могу посмотреть мои расходы списание денег карт за прошедшие месяцы года.
3706,Прочте расходы
3707,"почему переводы истории считаются, как траты расходы? Это неудобно. Почему переводы нельзя сделать отдельным пунктом учёта?"
3708,Как узнать траты за истории только начинается
3709,За траты по новой дебетовой карте
3710,"Рассматривал, не получается найти полную сумму"
3711,Не зависит от трат первые месяца?
3712,Какая сумма ушла
3713,"Даты, суммы"
3714,"Так на что их потратил? приход сркдств, расход за период по нигде не фигурируют"
3715,Трат было предостаточно
3716,Где посмотреть статистику расходов
3717,по моей кредитной карте теперь возможны только дебетовые расходы?
3718,"Там же есть условие по сумме трат, чтоб такой был?"
3719,"знаю видел уже... поэтому написал, больше никаких больших покупок"
3720,Сумма операции
3721,тратах за месяц указана сумма но чеке указана другая сумма. Как узнать сколько списали денег?
3722,при любых тратах по карте первые два месяца?
3723,Как узнать сколько мне осталось выполнить
3724,",у меня продукты,сколько нужно тратить от"
3725,"Мои картинки предоставлены на один момент времени. Значит, сумма приложении отображается неверно."
3726,То что деньги потратила
3727,готова ли моя новая карта
3728,Получить карту банке
3729,как давно меня карта Альфа банка?)
3730,Могу узнать перевыпустили мою карту?
3731,когда забрать карту можно?
3732,Моя карта пришла
3733,Как где могу забрать новую кредитную карту?
3734,",когда можно забрать карту?"
3735,Ирина все ещё не пришла
3736,карту где могу получить?
3737,Можно мне получить карту
3738,Когда будут готовы карты?
3739,Карта поступила
3740,можно уже карту получить?
3741,Сегодня выпустила карту ребенку взамен стикера. Когда ее можно получить
3742,Карта хаказана на дом
3743,Заказал ли кредитную карту
3744,Карта моя готова
3745,не готова ли моя кредитная карта?
3746,Заказала карту не получила сутки прошло уже
3747,"Сегодня сделала заявку на выпуск новой карты, когда её можно будет забрать"
3748,как получить пластиковую карту?
3749,",Если через приложение заказать пластиковую карту, через сколько она будет готоваи ее получить можно будет, только отделении банка?"
3750,"понедельник заказана карта, пришло сообщение, что могу забрать новую карту банке. Там нет сказал сотрудник. Где моя карта, когда могу получить"
3751,можно забрать эту карту офисе Пятигорске?
3752,заказывала карту Альфа-тревел. Могу её сегодня получить офисе на Марта
3753,"Не удобно, но что делать, получу на А. Петрова карта будет именная?"
3754,сама забрать карту завтра отделении банка
3755,вчера уже получил крту тнеименную
3756,"Мне сказали, что пришлют сообщение по готовности карты, прошло уже достаточно времени, карта нужна. Когда карта будет готова?"
3757,Есть на данный момент или карта чистая
