q_id,query_clean
5256,Активировать карту без получения
5257,Можно карту сейчас активировать чтоб могла на нее деньги перевести нее потом перевести
5258,Какая карта меня активна могу ли ей пользоваться
5259,вы активировали карту?
5260,активировать карту
5261,"когда-то оформлял карту Билайн, сейчас её не вижу перечне моих карт. она меня ещё активна, могу ей пользоваться?"
5262,Моли ли пользоваться картой без ее получения
5263,действительна ли меня дебетовая карта на данный момент?
5264,меня было активировано предложение по частичной оплате по крелитке
5265,"При активации карты ошибка ""функциональность временно недоступна"""
5266,кридитной картой не могу пользоваться до получения?
5267,Хотите сказать что мне нельзя пользоваться этой картой
5268,",появилось предложение закрытии долга по акции ,если хочу воспользоваться его нужно просто активировать?"
5269,хочу активировать карты на доп держателей
5270,"Почему не начисляется кэшбек не за услуги ЖКХ? Ваш банк заявлял что вас есть такой специально платила квартплату через Альфу, теперь кешбека по этим операциям не показывает"
5271,Почему не отобразился кешбэк по ЖКХ за покупку от руб.?
5272,"мне пришли света за квартиру где проживала когда снимала ее, квартира не моя Почему мне пришли оплата за ген за комунальные услуги?"
5273,какое количество счетов по жкх можно заплатить получить кешбек
5274,То что оплатила сегодня входит кэшбек?
5275,Кэшбэк по коммунальным услугам начисляется от рублей?
5276,"Только что провел платежа адрес одной компании. Один платеж прошел как комунальные услуги, второй как прочие расходы. Должно быть оба коммунальные услуги. исправить, т.к. ожидаю повышенный кэшбэк на эти операции"
5277,почему при кэшбеке нет комунальные платежи? обещали
5278,Плата за коммунальные услуги
5279,начисление кэшбека по категории коммунальные платежи Платеж от на сумму
5280,Почему не начисляется кеш бек за оплату коммунальных услуг?
5281,полгода кэшбека за жку как подключить?
5282,меня категория кэша на сентябрь коммунальные услуги
5283,"оплачиваю ЖКХ мне не начисляют кэшбэк ,выбрала категорию на сентябрь Жкх"
5284,Счета по Каким категориям нужно оплатить чтобы получить кэшбэк на жкх?
5285,"августе меня был кэшбек на оплату коммунальных услуг, августа была оплата за электричество онлайн приложении альфа банка, кэшбек не начислился по этой операции. Когда ожидать начисления кэшбека?"
5286,"Оплатила услуги ЖКХ, но кэшбек не увидела. Хотя категория выбрана эта."
5287,Почему не начислен кэшбэк за оплату ЖКУ за августа?
5288,оплатила ЖКХ приложении альфа банка кэшбэк операциях не отобразился.
5289,Мне придет кешбек за оплату коммунальных услуг
5290,Почему не начислен кэшбек за вчерашнюю оплату комуналки
5291,Почему за оплату коммунальных платеж нет кэшбека
5292,Когда придет кэш бэк за оплату налога
5293,"оплатила квитанцию по коммунальным услугам, но истории операций это отражается как прочие расходы не начислен кешбек, почему?"
5294,".Я оплатила комм.услуги,через альфа приложение,чтобы получить кэшбэк.А меня отражается как ""Прочие услуги"". Мне будет начислен кэшбэк?"
5295,кэшбэк за оплату жкх так понимаю не получу?
5296,За коммунальные услуги должен быть начислен повышенный кэшбэк!
5297,Почему не начисляется кэшбек на оплату коммунальных услуг? этом месяце он меня
5298,"оплатила коммунальные по карте, но кэшбека нет, мне обещали когда оформляли карту, что кэшбек за все"
5299,Когда начислят кешбек за оплату коммунальных услуг?
5300,"Если оплачу ЖКУ приложении, например самолета, картой альфы, начислят ли мне повышенный кэшбек?"
5301,Оплата коммунальных платежей госпошлин считается покупками?
5302,Если оплатила коммунальные услуги это считается
5303,Как начисляется кэшбек за оплату ЖКУ
5304,недавно попадалась предложение оплаты ЖКХ кэшбэком не могу найти
5305,как оплатить коммунальные услуги накопленным кэшбэком?
5306,Будет ли начислять кешбек за оплату по реквизитам?
5307,Оплатила коммунальные платежи когда начислят кэш?
5308,"максимальная сумма, которая может быть начислена по категории кэшбека Коммунальные услуги?"
5309,Учитывается или нет оплата коммунальных услуг при суммировании расходов для начисления повышенных процентов? условиях от противоречивая информация.
5310,Почему оплата ЖКХ прошла как прочие услуги? кэшбэка нет?
5311,оплатила все коммунальные услуги почему тут не обновляется?
5312,Почему не начислен кешбэк за оплату ЖКХ??
5313,какой кэшбек за оплату жкх
5314,мне на кредитку не пришли остальные деньги
5315,",оформила кредитную карту, деньги появятся после получения карты?"
5316,Деньги зачислятся на кредитную карту?
5317,оформил кредитную карту почему ее нет приложении?
5318,мне одобрили кредит. Когда придут деньги
5319,оформила сейчас рассрочку деньги не поступили
5320,"как приходят деньги,когда открыл только кредитную карту"
5321,По заявке по прдложению банка когда поступят деньги на счет.
5322,"Почему мне кредит начислят, когда просил подписывал документы на"
5323,"понедельник оформил кредит наличными, хочу уточнить по сроку получения дс?"
5324,"оформила кредит,когда придут деньги?"
5325,"Уточните когда прийдет кредитный договор, течении какого времени?"
5326,Поступление кредитных денег
5327,"Мне была одобрена карта, почему она не появилась приложении?"
5328,Когда придут деньги кредитные?
5329,когда закроют кредит
5330,"сегодня оформила кредит, но деньги еще не поступили. Как мне отказаться от кредита? Только банке?"
5331,"оформил кредит на почему-то главном меню пишется, что сентября начислим"
5332,"Вчера оформил кредит, счет есть, денег нет"
5333,"Почему, когда захожу лимиты кредитной карты отображается лимит по факту написано"
5334,.Когда кредит зачислят
5335,заказывала кредитную карту после регистрации она оказалась дебетовой
5336,Здраствуйте оформил кредитку здесь её нет
5337,оформила кредит на тыс но информации никакой нет
5338,"оформил кредитную карту ,а она не отображается личном кабинете"
5339,Зачислят деньги когда по кредиту
5340,",подруга оформила кредит но часов уже прошло ,почему средства еще не поступили"
5341,Оформила кредит но деньги на счет до сих пор не поступили
5342,поступили деньги за кредит?
5343,Средства на кредитной карте зачислят после получения?
5344,когда поступят деньги на карту по кредиткой карте
5345,куда придут деньги по кредиту
5346,Через сколько придут остальные рублей на кредитную карту?
5347,",я оформила кредитную карту,она не появилась"
5348,"Пришел кредит наличными на меньшую сумму. правильно понимаю, что сумму сразу удержали за прошлый кредит наличными?"
5349,"оформил кредитную карту, могу начать ею пользоваться без получения карты"
5350,"деньги по кредиту так не пришли,хотя сумма меньше"
5351,когда поступят деньги на счет? Брал кредит под залог автомобиля
5352,при оформлении кредитки деньги появляться только после получения ее
5353,когда прийдет остальная сумма на кредитную карту?
5354,"хочу узнать течении какого времени начислят кредит, двое суток прошло, так ничего не случилось, почему так долго перечисляется"
5355,оформила кредитку еще но почему не отображается приложении?
5356,",мне уже одобрили кредит,сказали деньги поступят после сентября,но уведомлениях написано про какие-то подписи приложении, нужно ли что-то подписать онлайн или деньги так прийдут"
5357,"Почему мне одобрили кредитка на сумму тысяч, по факту привезли на тысяч"
5358,как загрузить историю
5359,История
5360,хочу удалить банк строки переводов
5361,"не могу прогрузить историю чата, не вижу что вы написали"
5362,как проверить если ли меня -фз
5363,"делала перевод на рубль со счета которому имеет доступ личном кабинете. Нужна квитанция, не могу истории достать"
5364,Переводы странные
5365,По закрытому
5366,Кртдитных истории
5367,Оплатила только что штраф почему-то не вижу списание платежах
5368,Поднять историю переводов по предыдущей карте
5369,История рекондаций
5370,Где посмотреть исполненные ведомости
5371,от сегодняшнюю инкомус по сумме двойная оплата обо раза по вине банка- что не срабатывапет программа -только через полчаса появилось истории
5372,истории не видно списание денег
5373,Разблокируйте мой счет для переводов
5374,найдите перевод по идентификатору платежа:
5375,Выбрать операцию
5376,как могу посмотреть историю операций за июнь года?
5377,Почему то не вижу списание платежах
5378,Не вижу операции истории
5379,как посмотреть историю оплат за весь год выбрать нужные счета
5380,мне нужна история перевод по картам счетам за год .как где мне ее плучить
5381,Опять не вижу историю перевода где ??
5382,"понимаю, но не хочу чтобы они отображались при переводе на мой номер"
5383,"не могу знать, т.к. не вижу историю операций счета. Вы можете мне просто открыть доступ этому счету лк, чтобы посмотреть?"
5384,Где смогу посмотреть дошел ли мой платеж?
5385,Отметка операции
5386,"Оплачивал сейчас покупку по qr. Появлялось сообщение об успешном переводе, но истории этого нет. сумма"
5387,Через какое время истории платежей отразится перевод денежных средств?
5388,Куда направился последний перевод
5389,последний мой перевод
5390,Почему истории не вижу перевод на ₽?
5391,Почему истории платежей не отобразилась квитанция переводе средств?
5392,Хочу узнать историю пополнения
5393,"Странно, не вижу никакой операции за истории"
5394,совершал перевод по реквизитам истории его нет
5395,На скринах есть все операции по карте даты!
5396,Не показывается история всех списаний пополнений карты
5397,Последний перевод мне сделали
5398,За прошлый перевод мне нужно посмотреть сколько оставалось
5399,",почему оплатил штрафы гибдд через альфа онлайн,оплата прошла,но сейчас истории нет этого платежа штраф естественно не оплачен?такие попытки были раза"
5400,управление историей операций
5401,"последний вопрос,эти операций покупок можно сделать один день?"
5402,Кутолу Эми
5403,Карта виза
5404,можно оформить union pay?
5405,Заказал выпуск кредитной карты. Указал место получения филиал банка. Возможно ли использовать кредитную карту как виртуальную? Физически не могу забрать карту до сентября сейчас поездке.
5406,Картой беларуси
5407,Можно ли оплачивать картой ОАЭ
5408,"сентября буду Беларуси выпустила карту мир. Мне нужно вас предупреждать, чтобы вы ее не заблокировали за ""подозрительное"" снятие денег или оплату покупок?"
5409,Могу ли расплачиваться картой?
5410,возможно ли выпустить карту для использования за границей также оплаты через онлайн сервисы?
5411,кредитная карта Альфа банк действует юар?
5412,Можно ли пользоваться виртуальной кредитной картой?
5413,беларусами могу ли расплачиваться своей картой на которой написано мир?
5414,Visa останется
5415,Могу ли оплачивать картой?
5416,Карта Альфа банк Беларуси
5417,"Visa ,MasterCard можно оформить?"
5418,"Есть ли возможность открыть дебетовую карту Unionpay, для расчетов Китае?"
5419,Могу ли оплачивать нынешней онлайн картой?
5420,Минске если оплачивать картой своей альфа банка на ней мир написано) то по какому тарифу считается есть ли доп комиссия?
5421,"еду заграницу, будет ли работать там моя карта"
5422,Грузии Армении смогу расплачиваться картой Альфа Банка
5423,могу ли где-то снять деньги Казахстане дебетовой карты мир
5424,Индии работает карта cardlist?
5425,есть ли возможность через карту оплатить покупку App Store
5426,"обновил ваше приложение, но теперь лимит"
5427,На детской карте поставить запрет на любые переводы
5428,Можно ли установить бесплатное снятия наличных
5429,Запрет операций по карте
5430,"пытаюсь перевести, выходит надпись что установлен лимит руб., ограничение будет снято через часа. Что делать?"
5431,Могу ли как оо поставит запрет на снятия этой подписки? Или только перевыпуск карты?
5432,вошла сейчас Мака- та же истрия: 'установлен лимит'
5433,"Просьба снять ограничения на лимиты. Не понимаю что происходит сегодня, каждый раз при входе приходится вводить номер карты, устранились почему-то ограничения на переводы."
5434,Как убрать лимиты на
5435,Как поставить запрет на снятие
5436,Установите мне лимит на меньше
5437,Хочу поставить ограничения на списание денег
5438,Почему мне установили лимит день???
5439,Как убрать ограничение?
5440,Хочу вывести свои деньги накопительного счёта! появляется предупреждение: Лимиты на переводы платежи снижены до ₽. Снимем все ограничения через часа. Как отменить это ограничение? требую СВОИ ДЕНЬГИ!
5441,вроде не ставил лимиты
5442,установите
5443,Как убрать ограничения на покупки интернете?
5444,"привязать карту для получения средств платформы youdo, мне отказали поддержка сказала что это ограничения на карте, можно узнать откуда они как их снять?"
5445,Ограничить снятие наличных переводы
5446,Давайте вы мне поставите лимит контроль на неё.
5447,Запрет на операции интернете
5448,Лимит на траты
5449,каких лимитов на карте не установлено но платится все равно не могу
5450,Поставьте ограничение по карте Чтобы могла только пополнять счет
5451,нельзя снять деньги которые мне предоставил банк. Сделайте доступной мне эту функцию
5452,сегодня установила приложение филиале банка Как мне снять лимиты
5453,как установить лимит на снятие оплату карты
5454,Как поставить лимит на переводы
5455,"Вайлдбериз отвязал мою карту от личного кабинета по причине, что карта не действительна не может совершать покупки. есть ли какие-то ограничения по карте?"
5456,",как поставить лимит на покупки магазине"
5457,Убрать лимиты без пластика
5458,Как понимаю ввели ограничения на переводы снятия наличных чтобы заблокировать мошеннические операции мне необходимо перевести крупную сумму мужу как это сделать?
5459,Запрет на покупки интернете
5460,"Павел, очень вам помочь сейчас. сожалению, не могу изменить ограничения, так как вы сегодня зарегистрировались. Ограничение снимем через часа вы сможете совершить перевод"
5461,Требую снять ограничение на переводы!
5462,как снять ограничения
5463,как лимит на оплату сделать больше. Оплачиваю приложении не дает сумма
5464,не оплачивает карта магазине не даёт внести -пишит про какой-то лимит никакой лимит не устанавляивала -проверьте
5465,Как отключить постоянное ограничение на операции тыс????? Вы просто уничтожаете желание пользоваться вашей картой
5466,"Просьба снять ограничения на лимиты. Не понимаю что происходит сегодня, каждый раз при входе приходится вводить номер карты, устранились почему-то ограничения на переводы."
5467,"что нужно сделать, чтобы лимитов вне было больше?"
5468,что значит действуют ограничения приложении он лайн банк
5469,могу ли как-то убрать лимит пройти какую нибудь верефикацию?
5470,"Хочу открыть вклад, но карта не активна после смены пин кода. Когда будет работать?"
5471,как поменять пин код на карте?
5472,Как узнать пороль от карты
5473,Как менять пин-код
5474,",забыла пинкод,что делать этой ситуации?"
5475,Где посмотреть пин код?
5476,Как узнать код от карты?
5477,Как снять код ограничения?
5478,Как установить пин код на карте
5479,как узнать свой пин код
5480,Сменить пинкод карты
