q_id,query_clean
1,Номер счета
2,Где узнать бик счёт
3,Мне не приходят коды для подтверждения данной операции
4,"Оформила рассрочку ,но уведомлений никаких не пришло"
5,когда смогу пользоваться кредитной картой?
6,По истории платеж не отображается
7,рп. Нахабино отделение банка на улице Институская можно закрыть бизнес счет?
8,Узнать зарплатный счет
9,где могу увидеть дату начала пользование кредитной карты?
10,Не приходит смс
11,Не могу видеть на экране
12,Не могу войти альфа онлайн по номеру телефона
13,заказала кредитную карту мне одобрили почему мне не приходят СМС чтобы получить карту банке
14,как получить номер расчётного счёта
15,Мои счита
16,"Можно узнать, вчера пополнила сумму на за кредит? Куда списался платеж За кредит или налог ?Что теперь нужно сделать"
17,Как мне узнать БИК расчётный счёт
18,предоставить мне все мои счета
19,не вижу куда перешли деньги?
20,"отправил деньги банка на альфа банк, чтобы покрыть рассрочку чуть больше, на всякий случай). получили ли деньги, то приложении не видно?"
21,что происходит??? Снова мне не приходят смс
22,Не видно перевод истории операций
23,Кредитный счет
24,Кэшбэк
25,"записалась банк по времени, меня не принимают. Что делать?"
26,хочу узнать свой БИК
27,где кешбек обещанный?
28,"не вижу,в истории, списания пополнения карты за покупку магазине zolla,("
29,могу ли узнать что за операции последние на моей карты были
30,Не приходит смс для активации карты
31,"Могу ли оформить кредит, чтоб деньги сразу поступили на карту кабинет?"
32,Почему мне не приходят подтверждения по операции
33,Не пришла смс
34,Номер счета для получения зарплаты?
35,как узнать расчетный счет?
36,партнер одобрил заявку где она?
37,Расчетный щет
38,"Расчётный счёт, где посмотреть?"
39,Не приходят уведомления по операциям по кред карте
40,сейчас оплатила как эти увидеть платежи? истории нет их
41,Кэш
42,Как найти БИК банка
43,Поступили на счет руб
44,сумма поступила
45,Вы поможете оформить заявку?
46,Нет денег на кредитке
47,себе сделал новую карту пластик закажу сюда приложении не вижу её почему
48,как узнать привязана ли карта этому номеру
49,отменить запись отделение
50,Кредитный счёт
51,Расчетный счет
52,Сейчас оплачивала услугу циан. Почему не вижу истории списание на тысячи?
53,номер счета
54,прошла ли меня последняя оплата?
55,расчетный счет
56,вижу мобильном приложении только одну карту
57,Как узнать свой расчетный счет
58,хочу проверить транзакцию
59,Не могу найти это пополнение
60,Как удалить свой личный кабинет
61,Нужен лицевой счет
62,не приходят уведомления зачислении средств
63,"детскую карту ребёнку оформили, ребенку прислали перевод, почему не отображается сумма личном кабинете?"
64,"Бик карты нужен, счёт всё остальное"
65,Напиши номер моего ипотечного договора
66,Почему не приходят оповещения поступлении денежных средств?
67,"Здесь через вас или банк, офис?"
68,"Вопрос по кешбэку. вчера оплачивала авиабилеты, общая стоимость была руб. Вчера была скидка мне должно вернуться кэшбеком рублей"
69,"мая оплатила кредит, деньги пришли на счёт?"
70,Где посмотреть номер договора по карте?
71,Могу ли пользоваться средствами на карте до её получения
72,За продукты
73,Одобрили рублей
74,Куда делась моя кредитная карта?
75,",я случайно удалила карту лимитом .А счёт остался можно мне обратно карту вернуть приложение"
76,узнать откуда на счету кредитной карты деньги
77,Почему кредит не всю сумму мне дали?
78,Можно ли подтверждение переводов не по смс сделать? пуш или паролем для входа
79,Деньги поступили кредитная карта
80,этого номера заблокирован счёт.
81,Не сменить удалить
82,куда пришли деньги последнего пополнения
83,"Внесла платёж, хочу узнать поступили ли средства."
84,хочу узнать БИК БАНКА
85,"брал деньги рассрочку, оплатил досрочно. На счёту показывает р."
86,где будит высвечивается
87,Нет про другой кэшбек
88,Где посмотреть номер счёта карты
89,не вижу БИК банка
90,По какому адресу банк работает физическими лицами? меняют ли вас тенге на рубли
91,можно сделать кэшбека этого на оплату картой не стикером
92,меня номер заблокирован
93,Мне нужна история переводов год
94,"Можно ли получить код не пуш-уведомлением, сообщением на телефон?"
95,Куда пропали кредитные карты?почему не могу их найти?
96,"Посмотрел историю операций, поступлений нет"
97,оформила
98,",как мне заплатить за детский сад если банк не может найти реквизиты садика"
99,для работы
100,Можно сделать ещё одну дебетовую карту но привязать другой номер телефона?
101,Почему деньги не появляются на балансе?
102,Мои счета
103,на расчетный счёт пришла не вся сумма за вчерашний день
104,Как привязать номер карте чтоб мне делали перевод по номеру телефону
105,До какого она действует?
106,"Мне на счёт поступили детские пособия, выплата материнского капитала! Где эти деньги, почему их нет на счёте?"
107,Мне пришло предложение. Максимально сумма оформил на тысяч. отображается
108,Отделение митино время работы
109,Поступления есть от меня?
110,Какие счета меня действующие?
111,Откуда пришли деньги
112,Какой меня лимит по кредитной карте
113,Кешбек
114,Почему не вижу сколько денег на карте?
115,Не поступил на баланс
116,какой период пользовалась кредитной картой?
117,То есть пользоваться можно после получения пластика?
118,Расчётный счёт
119,"меня проблемы уведомлениями. Уведомление списаниях, пополнениях банкомата зарплате приходят, переводах нет. чем это может быть связано?"
120,Часы работы круглосуточно?
121,как могу узнать свой расчетный счет или сделать это?
122,За последние месяца
123,Не могу на экране найти кредитку лимитом
124,Бик нн банка
125,Реквизиты проверены
126,что за пополнение мне пришло? от лояльности банка
127,"случайно перевела деньги на кредитную карту, на которой нет задолженности, могу ли без комиссии перевести оттуда деньги?"
128,"Пишет что надо обновить номер телефона, но он меня остался прежним"
129,как узнать свой расчетный счет
130,Что платежами СБП?
131,Onetotrip
132,После перевыпуска карты меняются ли реквизиты счета
133,мне уведомления не приходят как пополнениях
134,"Просьба отключить кредитную часть моей карты, необходимо оставить только собственные средства"
135,мой расчетный счет
136,Работа
137,БИК банка где посмотреть
138,"Мне же надо номер карты вписать, не счета"
139,сейчас внесла кредит как посмотреть что сумма внесена
140,прошла ли последняя операция на рублей
141,.как найти платеж сентября
142,Как отвязать карту если привязал ее другому телефону
143,когда меня открыта кредитная карта?
144,Не получается узнать срок действия
145,завтра по возможности подъеду отделение Пушкино
146,Операцию
147,оформлял крилитную карту на не на
148,Проверить имеющиеся карты
149,Как узнать бик
150,нужен скан реквизитов
151,на какой счет ушли задолженность по карте оплатить
152,Тот кто получил деньги владелец телефона совершенно разные люди.
153,почему на кредитной карте не отображается сумма лимита?
154,По определённой операции
155,Как получить временный пароль
156,Картхолдер
157,"Мне нужен БИК Банка Расчётный счет, ни где нету могу найти"
158,Как привязать номер ребёнка детской карте
159,"Как установить пароль, если приложение просит ввести текущий, которого нет?"
160,Куда вносить сумму долга
161,На детскую карту не приходят смс
162,Можно уточнить какие меня карты
163,Номер карты подорожник указана не верно
164,истории операций не отображается
165,Оспаривание операций
166,"Адрес: Кызыл, ул Ленина, д."
167,Маркетплейсы кэшбэк
168,Оформил заём когда он придет
169,"мая банк работает? Имею виду, завтра поедем оформлять авто кредит, нам могут завтра на него ответ дать или нет?"
170,какого числа действует счёт
171,"меня приходит зарплата на карту альфа,уведомленийнет,почему"
172,Номер карты меняется
173,Как связаться управляющем отделения городе Туапсе
174,"получила карту спешке аэропорту, сейчас понимаю что она мне не нужна"
175,"Расскажите, про карту Альфа-тревел? Она за границей действует для покупок/переводов итд. Или выгода только приобретении туристических услуг?"
176,"отделении подписывала бумаги, но денег нет"
177,Не могу найти счет кредита
178,Муж выпустил на меня карту но она не отображается кабинете
179,"Бонус сверху ,что даёт?"
180,Не видно откуда пришли деньги?
181,Где найти бик банка?
182,как узнать БИК
183,Почему денег нет на карте?
184,"Посмотрите, деньги пришли?"
185,Пришлите реквизиты кредитной карты Альфа бизнеса
186,Как узнать какой карты расчётный счет
187,карта приложении появится только после того как ее заберу
188,Почему не приходит уведомление кодом по смс
189,л. Лл
190,Почему не отображаются деньги на счету?
191,Обращение давал на отвязку чужого счета от моего номера. привязали не тот
192,Какой еще кредитный счет
193,"откуда тогда он взял эту сумму, она нигде не отображается"
194,куда делись карты? приложннии?
195,.не вижу этих денег на счетах
196,Телефон на детской карте
197,Мой расчётный счёт
198,Куда перевела деньги
199,Перенести визит банк
200,Проверочнве СМС не приходят
201,только что оформил кредитную карту
202,почему не вижу счет кредитной карты?
203,По операциям
204,Где посмотреть всё мои счета
205,Почему не приходят уведомления смс переводе мне денежных средств??
206,Операции
207,Только что пришло на телефон
208,Смена пароля
209,Вопрос по кешбку на моих картах
210,Одобрили кредит где деньги
211,"Мне нужны уведомления на телефон, не смс уведомление от банка"
212,почему меня приложении не высвечивается карта ребенка?
213,"При попытке активации карты должен ввести код, который должен прийти на мой номер телефона, но он не приходит. Что мне делать?"
214,Чтобы открыть вклад требуется смс код?
215,Не отображается карта
216,"Каждый раз мне приходится вводить номер карты номер телефона, что происходит, как это убрать"
217,Бик
218,Когда закончится срок использования карты
219,Переводы мне были сегодня
220,"можете проверить, не поступали ли мне переводы за сегодня или может они были отклонены?"
221,Как посмотреть платеж
222,"Где Ростове отделение банка находится, для написания заявления вернуть деньги"
223,"Оформлена кредитная карта на моё имя чужим человеком, карты нет личном кабинете"
224,номер карты
225,Как снять остаток средств со счета закрыт счет Альфа банке?
226,Как получаю
227,Когда будет доступна кредитка приложении?
228,При смене номера нет доступа приложению
229,как найти все или оплаты адрес ООО кладовкин?
230,Мне одобрили кредитную карту личном кабинете она не появилась
231,Куда уходят пополнения?
232,Не отображается список карт
233,"при входе приложение выходит ""обновить номер телефона"" Нажимаю, что меня тот же номер, ошибка. Что делать?"
234,Какие Банкоматы работает сегодня город Якутск
235,Хочу погасить рассрочку на Не могу найти номер счёта
236,мне нужно обновить данные по номеру телефона
237,Исчезла карта привязанная зарплатному счету
238,Было ли пополнения рассрочки
239,Почему то не приходит смс на активацию электронной подписи альфа инвестициях
240,Прошёл ли платёж?
241,как узнать бик?
242,Когда была открыта кредитка?
243,Номер счета карты
244,"сегодня получила карту альфа банк, номер карты не совпадаем картой онлайн, на карте другой приложении другой номер картв"
245,Не поступают уведомления пополнение карты
246,почему не показывает реквизиты?
247,Банк на каминтери
248,Реквизиты можно мне атправит немагу найти
249,Как телефонные номера поменять местами?
250,Кешаут
251,Нужна ссылка для входа онлайн банк
252,"хочу закрыть счёт, на который брала деньги рассрочку, сумму недостающую внесла, но почему-то не могу закрыть, помогите закрыть рассрочку"
253,Мне не надо чтобы оно так отображалось
254,Почему не стали приходить смс оповещения?
255,Последняя оплата Инфо
256,Как узнать лицевой счёт
257,По закрытому открытому счету нужна история операций за год
258,Мне на счет поступило
259,"сейчас положила деньги на карту, не могу найти их списание"
260,"Операции, произведенные более чем год назад"
261,Операции по картам
262,Куда ушли пополнения на карту?
263,"Ещё не получил кредитную карту, как узнать лимит"
264,"реквизитах нет расчетного счета банка, он мне нужен для возврата штрафа"
265,Не приходят уведомления списании средств
266,Меня интересует дата когда заблокировала карты
267,Перевод тыс через СБП минут назад. Почему не вижу перевод истории платежей?
268,"Для оплаты не приходит смс, уведомления включены Как быть?"
269,Узнать адрес оплаты картой
270,Где он указывается?
271,Если дата платежа завтра по кредитным каникулам решение нужно принять сегодня или можно утра Необходимо изучить информацию
272,"Эта выписка по оддному кредиту? меня несколько кредитов, по ним один договор?"
273,"Нет, не понятно. числа было два поступление, одно перевела себе накоплений. сразу перевела другому человеку. каких накоплениях деньги?"
274,где посмотреть номера договора на кредитную карту
275,"Пришлите выписку из банка содержащую: наименование банка, расчетный счет, БИК банка"
276,Такси за наш счет мае
277,мне нужен номер договора альфа страхования -жизнь по погашенному кредиту
278,Где могу это отслеживать
279,Последний перевод
280,Счёта
281,Где посмотреть БИК счёт карты
282,Куда исчезла моя карта?
283,Как узнать БИК банка
284,Где могу найти счёт которому привязана моя карта
285,Сегодня праздничный или выходной день?
286,"Почему не вижу все поступления. Например, зарплату?"
287,Можно узнать где зачисление?
288,Мои кешбеки
289,Могу узнать номера договоров страховки по тем кредитам которые закрыла досрочно?
290,почему мне не приходят уведомления зачислениях таких как заработная плата. Пуш уведомления включены настройках
291,апреля была операция по зачислению руб. Откуда это куда были зачислены деньги?
292,"Мне озон подарок отправил сотрудника Альфа-Банка, привезли как получить на карту кеш бек?"
293,Вопрос по начислению кэшбека
294,Сумма поступления по дебетовой карты
295,история об оплате почему нет
296,"брала деньги рассрочку, на счету остались мои руб, как могу её получить"
297,почему не отображается кредитная карта?
298,Что делать если не приходит код для активации карты?
299,подключить кэшбек
300,запросить дебетового счета
301,Проверить пополнение счета рассрочки
302,Операции нет истории
303,куда ушло пополнение на руб
304,"меня подключены именно уведомления по смс профиле, но они не приходят"
305,Бонус
306,Адрес регистрации
307,Пополнила баланс
308,Интересует лимит по кредитной карте
309,Как мне быть операция прошла или нет
310,БИК код банка
311,Когда меня был баланс?
312,Кэшбэк по операции
313,На мой счет поступила сумма рублей от неизвестного отправителя
314,Сегодня рабочий день или на бирже выходной
315,Кредитный лимит
316,Расчетный счёт
317,Не могу ребенку подключить приложение не приходит СМС на телефон что делать?
318,Почему не вижу карту онлайн банке на которой
319,Почему СМС не получил?
320,Моя история по кредиту
321,Почему приложении не отображался кредит получил смс сейчас сразу оплатил!
322,Не могу просмотреть реквизиты
323,Поступили денежные средства на кредит
